{
  "game_id": "mixed_v2_10p-g0043",
  "model_id": "eleven_flash_v2_5",
  "output_format": "mp3_44100_64",
  "voices": {
    "narrator": "N2lVS1w4EtoT3dr4eOWO",
    "narrator_night": "SOYHLrjzK2X1ezoPC6cr"
  },
  "clips": [
    {
      "seq": 1,
      "category": "narrator",
      "speaker": "narrator",
      "voice": "narrator_night",
      "voice_id": "SOYHLrjzK2X1ezoPC6cr",
      "text": "Night 1. The village sleeps.",
      "file": "c27ca0c1984731b0e3587efc1a9b8bd6cef9e59e.mp3"
    },
    {
      "seq": 13,
      "category": "narrator",
      "speaker": "narrator",
      "voice": "narrator_night",
      "voice_id": "SOYHLrjzK2X1ezoPC6cr",
      "text": "Nobody died last night.",
      "file": "0e02ef3d51a70da3ef8408388159efd2cba44b2e.mp3"
    },
    {
      "seq": 14,
      "category": "narrator",
      "speaker": "narrator",
      "voice": "narrator",
      "voice_id": "N2lVS1w4EtoT3dr4eOWO",
      "text": "Day 1. The village wakes.",
      "file": "3c28e64e935ae38dfc8ffd82fe7df91b48957d5e.mp3"
    },
    {
      "seq": 68,
      "category": "narrator",
      "speaker": "narrator",
      "voice": "narrator",
      "voice_id": "N2lVS1w4EtoT3dr4eOWO",
      "text": "Day 1. Time to vote.",
      "file": "50bb2dbe1551c36d70df0374a53a1afb08132c82.mp3"
    },
    {
      "seq": 79,
      "category": "narrator",
      "speaker": "narrator",
      "voice": "narrator",
      "voice_id": "N2lVS1w4EtoT3dr4eOWO",
      "text": "The village voted out Iris, a wolf.",
      "file": "c5ba776b4b0f86454e3f582060f4e983feac9d7d.mp3"
    },
    {
      "seq": 80,
      "category": "narrator",
      "speaker": "narrator",
      "voice": "narrator_night",
      "voice_id": "SOYHLrjzK2X1ezoPC6cr",
      "text": "Night 2. The village sleeps.",
      "file": "5eb6f9a8edc27da499995f2a943cf8667d1c6411.mp3"
    },
    {
      "seq": 85,
      "category": "narrator",
      "speaker": "narrator",
      "voice": "narrator_night",
      "voice_id": "SOYHLrjzK2X1ezoPC6cr",
      "text": "The wolves struck. Jude, the Doctor, was found dead.",
      "file": "e6ccff2f491393ce8f398c935469463b3c2bba47.mp3"
    },
    {
      "seq": 86,
      "category": "narrator",
      "speaker": "narrator",
      "voice": "narrator",
      "voice_id": "N2lVS1w4EtoT3dr4eOWO",
      "text": "Day 2. The village wakes.",
      "file": "bb6d580c4b68d35b41c6899ef728ceb4f509fa23.mp3"
    },
    {
      "seq": 137,
      "category": "narrator",
      "speaker": "narrator",
      "voice": "narrator",
      "voice_id": "N2lVS1w4EtoT3dr4eOWO",
      "text": "Day 2. Time to vote.",
      "file": "3c67f5d733bf17628bac2338ebb08410f94e6f98.mp3"
    },
    {
      "seq": 146,
      "category": "narrator",
      "speaker": "narrator",
      "voice": "narrator",
      "voice_id": "N2lVS1w4EtoT3dr4eOWO",
      "text": "The village voted out Dev, a villager.",
      "file": "b454fb80b6b3604938348f4b48c54aa9999172c0.mp3"
    },
    {
      "seq": 147,
      "category": "narrator",
      "speaker": "narrator",
      "voice": "narrator_night",
      "voice_id": "SOYHLrjzK2X1ezoPC6cr",
      "text": "Night 3. The village sleeps.",
      "file": "cf63a48f8d9d5de84554e5c176205f8c3fdf1ff2.mp3"
    },
    {
      "seq": 151,
      "category": "narrator",
      "speaker": "narrator",
      "voice": "narrator_night",
      "voice_id": "SOYHLrjzK2X1ezoPC6cr",
      "text": "The wolves struck. Ben, the Seer, was found dead.",
      "file": "050e4d14dea8804dbb320f724e24cecfa1922d7b.mp3"
    },
    {
      "seq": 152,
      "category": "narrator",
      "speaker": "narrator",
      "voice": "narrator",
      "voice_id": "N2lVS1w4EtoT3dr4eOWO",
      "text": "Day 3. The village wakes.",
      "file": "4feae53f92cd6b30bb09f11047fd43d653533f28.mp3"
    },
    {
      "seq": 190,
      "category": "narrator",
      "speaker": "narrator",
      "voice": "narrator",
      "voice_id": "N2lVS1w4EtoT3dr4eOWO",
      "text": "Day 3. Time to vote.",
      "file": "88314a649c215047a68ce43f1081c8bb4049d83c.mp3"
    },
    {
      "seq": 197,
      "category": "narrator",
      "speaker": "narrator",
      "voice": "narrator",
      "voice_id": "N2lVS1w4EtoT3dr4eOWO",
      "text": "The village voted out Ava, a villager.",
      "file": "60e14cf5d5007613bec073b734c65de42b67b6f9.mp3"
    },
    {
      "seq": 198,
      "category": "narrator",
      "speaker": "narrator",
      "voice": "narrator_night",
      "voice_id": "SOYHLrjzK2X1ezoPC6cr",
      "text": "Night 4. The village sleeps.",
      "file": "3bf20ec07097493b501a035bb391fe64916ec814.mp3"
    },
    {
      "seq": 201,
      "category": "narrator",
      "speaker": "narrator",
      "voice": "narrator_night",
      "voice_id": "SOYHLrjzK2X1ezoPC6cr",
      "text": "The wolves struck. Gia, a villager, was found dead.",
      "file": "5742b62824d126a822d4dc16bb8b9886f8d922ff.mp3"
    },
    {
      "seq": 202,
      "category": "narrator",
      "speaker": "narrator",
      "voice": "narrator",
      "voice_id": "N2lVS1w4EtoT3dr4eOWO",
      "text": "Day 4. The village wakes.",
      "file": "7ecf02ba7c58fe3f2ac5a5f628229490e429503a.mp3"
    },
    {
      "seq": 230,
      "category": "narrator",
      "speaker": "narrator",
      "voice": "narrator",
      "voice_id": "N2lVS1w4EtoT3dr4eOWO",
      "text": "Day 4. Time to vote.",
      "file": "06a9ed41c5bb3ea60c69a898e12ff17f9fa46f86.mp3"
    },
    {
      "seq": 235,
      "category": "narrator",
      "speaker": "narrator",
      "voice": "narrator",
      "voice_id": "N2lVS1w4EtoT3dr4eOWO",
      "text": "The village voted out Cleo, a villager.",
      "file": "33876232c376670172d2f241305f9a1133ead40c.mp3"
    },
    {
      "seq": 236,
      "category": "narrator",
      "speaker": "narrator",
      "voice": "narrator_night",
      "voice_id": "SOYHLrjzK2X1ezoPC6cr",
      "text": "Night 5. The village sleeps.",
      "file": "04db29f4b5fd984f29fd514854624246578ce3a6.mp3"
    },
    {
      "seq": 239,
      "category": "narrator",
      "speaker": "narrator",
      "voice": "narrator_night",
      "voice_id": "SOYHLrjzK2X1ezoPC6cr",
      "text": "The wolves struck. Finn, a villager, was found dead.",
      "file": "eedb73217c21ed1a201a365809ced84315f57b8b.mp3"
    },
    {
      "seq": 240,
      "category": "narrator",
      "speaker": "narrator",
      "voice": "narrator",
      "voice_id": "N2lVS1w4EtoT3dr4eOWO",
      "text": "The wolves win. They now match the village.",
      "file": "2da113cab32de3948c371731280887742fd0736b.mp3"
    }
  ]
}
